<?xml version="1.0" encoding="UTF-8"?>
<!DOCTYPE sistemaSolar SYSTEM "sistemasolar.dtd">
<sistemaSolar>
  <cuerpo>
    <planeta>venus</planeta>
     <planeta>tierra</planeta>
      <planeta>marte</planeta>
       <planeta>jupiter</planeta>
       <satelite>luna</satelite>
       <asteroide>pum</asteroide>
  </cuerpo>
</sistemaSolar>